{
  "approval_reference": "approval/example-site",
  "contract_version": "platform-bootstrap-target/v1",
  "gitea_identity_sha256": "cccccccccccccccccccccccccccccccccccccccccccccccccccccccccccccccc",
  "gitea_version": "1.26.4",
  "repository_identity_sha256": "bbbbbbbbbbbbbbbbbbbbbbbbbbbbbbbbbbbbbbbbbbbbbbbbbbbbbbbbbbbbbbbb",
  "required_ci": [
    "CI / test (pull_request)"
  ],
  "target_identity_sha256": "aaaaaaaaaaaaaaaaaaaaaaaaaaaaaaaaaaaaaaaaaaaaaaaaaaaaaaaaaaaaaaaa"
}
